{"approved_acquisition_methods":["LOCAL_EXPORT","MANUAL_RECORDED","SIMILARWEB_API_ENTITLED","SIMILARWEB_DATA_EXPORTER"],"automated_platform_scraping_authorized":false,"errors":[],"external_actions":[],"external_distribution_authorized":false,"external_execution_authorized":false,"plan_hash":"d909686370ce78a3884b192c6b26958beea6de54ba787d7dc5476db5df782bf5","plan_id":"similarweb_trial_capture_v1","readiness_hash":"21da3c172b5c3119fb9bbe63914e2bfd8e237193e7cf178be3e352726fa66e61","status":"READY_FOR_HUMAN_TARGET_REVIEW","target_count":15,"targets":[{"countries":["US"],"domain":"dominionhealing.org","metrics":["average_visit_duration_seconds","bounce_rate","channel_shares","estimated_visits","geography_shares","pages_per_visit","referral_domains","search_keywords"],"priority":1,"purpose":"OWNED_BASELINE","vertical_id":"commerce_fulfillment"},{"countries":["US"],"domain":"thorne.com","metrics":["average_visit_duration_seconds","bounce_rate","channel_shares","estimated_visits","geography_shares","pages_per_visit","referral_domains","search_keywords"],"priority":2,"purpose":"CATEGORY_LEADER","vertical_id":"commerce_fulfillment"},{"countries":["US"],"domain":"ritual.com","metrics":["average_visit_duration_seconds","bounce_rate","channel_shares","estimated_visits","geography_shares","pages_per_visit","referral_domains","search_keywords"],"priority":3,"purpose":"CATEGORY_LEADER","vertical_id":"commerce_fulfillment"},{"countries":["US"],"domain":"iherb.com","metrics":["average_visit_duration_seconds","bounce_rate","channel_shares","estimated_visits","geography_shares","pages_per_visit","referral_domains","search_keywords"],"priority":4,"purpose":"CATEGORY_LEADER","vertical_id":"commerce_fulfillment"},{"countries":["US"],"domain":"vitacost.com","metrics":["average_visit_duration_seconds","bounce_rate","channel_shares","estimated_visits","geography_shares","pages_per_visit","referral_domains","search_keywords"],"priority":5,"purpose":"CATEGORY_LEADER","vertical_id":"commerce_fulfillment"},{"countries":["US"],"domain":"vitaminshoppe.com","metrics":["average_visit_duration_seconds","bounce_rate","channel_shares","estimated_visits","geography_shares","pages_per_visit","referral_domains","search_keywords"],"priority":6,"purpose":"CATEGORY_LEADER","vertical_id":"commerce_fulfillment"},{"countries":["US"],"domain":"gnc.com","metrics":["average_visit_duration_seconds","bounce_rate","channel_shares","estimated_visits","geography_shares","pages_per_visit","referral_domains","search_keywords"],"priority":7,"purpose":"CATEGORY_LEADER","vertical_id":"commerce_fulfillment"},{"countries":["US"],"domain":"cymbiotika.com","metrics":["average_visit_duration_seconds","bounce_rate","channel_shares","estimated_visits","geography_shares","pages_per_visit","referral_domains","search_keywords"],"priority":8,"purpose":"DIRECT_BENCHMARK","vertical_id":"commerce_fulfillment"},{"countries":["US"],"domain":"happymammoth.com","metrics":["average_visit_duration_seconds","bounce_rate","channel_shares","estimated_visits","geography_shares","pages_per_visit","referral_domains","search_keywords"],"priority":9,"purpose":"DIRECT_BENCHMARK","vertical_id":"commerce_fulfillment"},{"countries":["US"],"domain":"three.store","metrics":["average_visit_duration_seconds","bounce_rate","channel_shares","estimated_visits","geography_shares","pages_per_visit","referral_domains","search_keywords"],"priority":10,"purpose":"DIRECT_BENCHMARK","vertical_id":"commerce_fulfillment"},{"countries":["US"],"domain":"wellnessshoppingonline.com","metrics":["average_visit_duration_seconds","bounce_rate","channel_shares","estimated_visits","geography_shares","pages_per_visit","referral_domains","search_keywords"],"priority":11,"purpose":"DIRECT_BENCHMARK","vertical_id":"commerce_fulfillment"},{"countries":["US"],"domain":"terrasomawellness.com","metrics":["average_visit_duration_seconds","bounce_rate","channel_shares","estimated_visits","geography_shares","pages_per_visit","referral_domains","search_keywords"],"priority":12,"purpose":"DIRECT_BENCHMARK","vertical_id":"commerce_fulfillment"},{"countries":["US"],"domain":"semrush.com","metrics":["average_visit_duration_seconds","bounce_rate","channel_shares","estimated_visits","geography_shares","pages_per_visit","referral_domains","search_keywords"],"priority":13,"purpose":"SERVICE_PRODUCT_BENCHMARK","vertical_id":"services_lead_generation"},{"countries":["US"],"domain":"ahrefs.com","metrics":["average_visit_duration_seconds","bounce_rate","channel_shares","estimated_visits","geography_shares","pages_per_visit","referral_domains","search_keywords"],"priority":14,"purpose":"SERVICE_PRODUCT_BENCHMARK","vertical_id":"services_lead_generation"},{"countries":["US"],"domain":"spyfu.com","metrics":["average_visit_duration_seconds","bounce_rate","channel_shares","estimated_visits","geography_shares","pages_per_visit","referral_domains","search_keywords"],"priority":15,"purpose":"SERVICE_PRODUCT_BENCHMARK","vertical_id":"services_lead_generation"}],"trial_started":false,"warnings":["human_target_review_required_before_trial_activation"]}
